{
  "system": {
    "id": "sys_001",
    "name": "Enterprise Hub",
    "metadata": {
      "created_by": "admin_user",
      "created_at": "2025-01-01T00:00:00Z",
      "tags": ["critical", "internal"],
      "notes": null
    },
    "status": {
      "online": true,
      "uptime_hours": 10234.75,
      "maintenance": {
        "scheduled": false,
        "history": [
          {
            "date": "2024-12-01",
            "duration_minutes": 90,
            "type": "emergency"
          },
          {
            "date": "2023-11-10",
            "duration_minutes": 60,
            "type": "routine"
          }
        ]
      }
    }
  },
  "modules": [
    {
      "type": "auth",
      "config": {
        "methods": ["password", "otp", "sso"],
        "settings": {
          "otp_timeout": 300,
          "sso_provider": "Azure"
        }
      }
    },
    {
      "type": "storage",
      "config": {
        "providers": [
          {
            "name": "aws_s3",
            "region": "us-west-2",
            "buckets": ["app-data", "logs"]
          },
          {
            "name": "gcp_storage",
            "region": "asia-east1",
            "buckets": []
          }
        ],
        "redundancy": "multi-region"
      }
    }
  ],
  "users": [
    {
      "id": "u_1",
      "profile": {
        "name": "Alice",
        "roles": ["admin", "dev"],
        "settings": {
          "dark_mode": true,
          "language": "en"
        }
      },
      "activity": [
        {
          "event": "login",
          "timestamp": "2025-01-10T10:00:00Z",
          "ip": "10.0.0.1"
        },
        {
          "event": "update_config",
          "timestamp": "2025-01-11T12:00:00Z",
          "changes": {
            "field": "sso_provider",
            "old": "Okta",
            "new": "Azure"
          }
        }
      ]
    },
    {
      "id": "u_2",
      "profile": {
        "name": "Bob",
        "roles": ["viewer"],
        "settings": null
      },
      "activity": [
        {
          "event": "view_logs",
          "timestamp": "2025-01-12T08:00:00Z",
          "logs_accessed": ["log-001", "log-002", "log-003"]
        }
      ]
    }
  ],
  "logs": [
    [
      { "timestamp": "2025-01-01T01:00:00Z", "level": "info", "message": "System booted" },
      { "timestamp": "2025-01-01T01:01:00Z", "level": "warning", "message": "Low memory" }
    ],
    [
      { "timestamp": "2025-01-02T02:00:00Z", "level": "error", "message": "Disk failure" }
    ]
  ],
  "flags": {
    "beta": true,
    "features_enabled": ["logs_view", "export_data"],
    "deprecated_features": []
  },
  "notes": null
}